name,carrier,control,generator,comment
power,electricity_ac,Slack,onshore_wind,High-voltage AC bus collecting renewable generation and exports to downstream conversion equipment.
ammonia,Ammonia,Slack,,Terminal bus representing ammonia product; sized implicitly via loads and link conversions.
power_storage,electricity_stored,Slack,,Buffer bus for the battery interface links.
hydrogen,Hydrogen,Slack,,Intermediate hydrogen stream between electrolysis and synthesis.
hydrogen_storage,Hydrogen,Slack,,Hydrogen storage state bus.
ramp_penalty,electricity_ac,Slack,ramp_dummy,Virtual bus for enforcing ramp penalties on the Haber-Bosch unit.
ramp_penalty_dest,electricity_ac,Slack,,Destination bus for ramp-penalty accumulation.
